Sheet: Sheet1
A1: refdes | B1: footprint | C1: value | D1: manuf | E1: manuf-pn | F1: mouser-pn | I1: farnell-pn | N1: qty
A2: BR1,BR2 | B2: TS_DBLS.fp | C2: DF01 | D2: Taiwan Semiconductor | E2: DBLS203G | F2: 821-DBLS203G | G2: 0.368 | H2: of:=[.O2]*[.G2] -> 3.68 | I2: 1299298 | J2: 88.76 | K2: of:=[.J2]*MAX([.M2];[.O2]) -> 887.6 | L2: of:=[.K2]/300 -> 2.95866666666667 | N2: 2 | O2: of:=[.N2]*5 -> 10 | S2: X
A3: C1,C2,C3 | B3: CP_CAN_200.fp | C3: 470µ | D3: Nichicon | E3: UPW1H471MHD | F3: 647-UPW1H471MHD | G3: 0.504 | H3: of:=[.O3]*[.G3] -> 7.56 | I3: 9693815 | J3: 129.52 | K3: of:=[.J3]*MAX([.M3];[.O3]) -> 1942.8 | L3: of:=[.K3]/300 -> 6.476 | M3: 5 | N3: 3 | O3: of:=[.N3]*5 -> 15 | Q3: TBD | S3: !!!
A4: C10,C11,C12,C4,C5,C6 | B4: C_1210.fp | C4: 10µ | D4: Taiyo Yuden | E4: UMK325BJ106MM-T | F4: 963-UMK325BJ106MM-T | G4: 0.448 | H4: of:=[.O4]*[.G4] -> 13.44 | I4: 2094047 | J4: 190.47 | K4: of:=[.J4]*MAX([.M4];[.O4]) -> 5714.1 | L4: of:=[.K4]/300 -> 19.047 | N4: 6 | O4: of:=[.N4]*5 -> 30 | Q4: in stock? | S4: X
A5: C7,C8,C9 | B5: C_0805.fp | C5: 10n | D5: Vishay | E5: VJ0805Y103KXBMC | F5: 77-VJ0805Y103KXBMC | G5: 0.048 | H5: of:=[.O5]*[.G5] -> 0.72 | I5: 2332514 | J5: 38.09 | K5: of:=[.J5]*MAX([.M5];[.O5]) -> 571.35 | L5: of:=[.K5]/300 -> 1.9045 | N5: 3 | O5: of:=[.N5]*5 -> 15 | Q5: in stock? | S5: X
A6: D1,D2,D3 | B6: D_SMA.fp | C6: 1N4001 | D6: Diodes Inc | E6: S1A-13-F | F6: 621-S1A-F | G6: 0.224 | H6: of:=[.O6]*[.G6] -> 3.36 | I6: 1858625 | J6: 22.86 | K6: of:=[.J6]*MAX([.M6];[.O6]) -> 342.9 | L6: of:=[.K6]/300 -> 1.143 | N6: 3 | O6: of:=[.N6]*5 -> 15 | S6: X
A7: F1 | B7: F_1812.fp | C7: 0.5A | D7: TE Connectivity | E7: MINISMDC050F-2 | F7: 650-MINISMDC050F-2 | G7: 0.248 | H7: of:=[.O7]*[.G7] -> 1.24 | I7: 1175839 | J7: 103.61 | K7: of:=[.J7]*MAX([.M7];[.O7]) -> 518.05 | L7: of:=[.K7]/300 -> 1.72683333333333 | N7: 1 | O7: of:=[.N7]*5 -> 5 | Q7: TBD | S7: X
A8: F2,F3 | B8: F_1812.fp | C8: 0.14A | D8: Cooper Bussmann | E8: PTS181260V014 | F8: 504-PTS181260V014 | G8: 0.16 | H8: of:=[.O8]*[.G8] -> 1.6 | I8: 1822211 | J8: 152.37 | K8: of:=[.J8]*MAX([.M8];[.O8]) -> 1523.7 | L8: of:=[.K8]/300 -> 5.079 | N8: 2 | O8: of:=[.N8]*5 -> 10 | Q8: TBD | S8: X
A9: J1,J2 | B9: TE_AMPMODU_MTE_6.fp | D9: TE Connectivity | E9: 5-104362-5 | F9: 571-5-104362-5 | G9: 0.898 | H9: of:=[.O9]*[.G9] -> 8.98 | I9: 2429566 | J9: 594.25 | K9: of:=[.J9]*MAX([.M9];[.O9]) -> 5942.5 | L9: of:=[.K9]/300 -> 19.8083333333333 | N9: 2 | O9: of:=[.N9]*5 -> 10 | S9: -
A10: R1,R2,R3 | B10: R_0805.fp | C10: DNP | D10: Vishay | E10: CRCW08050000Z0EA | F10: 71-CRCW0805-0-E3 | G10: 0.064 | H10: of:=[.O10]*[.G10] -> 0.96 | I10: 2073603 | J10: 2.67 | K10: of:=[.J10]*MAX([.M10];[.O10]) -> 267 | L10: of:=[.K10]/300 -> 0.89 | M10: 100 | N10: 3 | O10: of:=[.N10]*5 -> 15 | P10: 0 | Q10: in stock? | S10: X
A11: R4,R6,R9 | B11: R_0805.fp | C11: 196 | D11: Vishay | E11: CRCW0805196RFKEA | F11: 71-CRCW0805-196-E3 | G11: 0.064 | H11: of:=[.O11]*[.G11] -> 0.96 | I11: 2141755 | J11: 13.33 | K11: of:=[.J11]*MAX([.M11];[.O11]) -> 199.95 | L11: of:=[.K11]/300 -> 0.6665 | N11: 3 | O11: of:=[.N11]*5 -> 15 | P11: 220 | S11: X
A12: R5 | B12: R_0805.fp | C12: 590 | D12: Vishay | E12: CRCW0805590RFKEA | F12: 71-CRCW0805-590-E3 | G12: 0.064 | H12: of:=[.O12]*[.G12] -> 0.32 | I12: 2141782 | J12: 13.33 | K12: of:=[.J12]*MAX([.M12];[.O12]) -> 66.65 | L12: of:=[.K12]/300 -> 0.222166666666667 | N12: 1 | O12: of:=[.N12]*5 -> 5 | P12: 665 | S12: X
A13: R7,R8 | B13: R_0805.fp | C13: 1.69k | D13: Vishay | E13: CRCW08051K69FKEA | F13: 71-CRCW08051K69FKEA | G13: 0.064 | H13: of:=[.O13]*[.G13] -> 0.64 | I13: 2141804 | J13: 13.33 | K13: of:=[.J13]*MAX([.M13];[.O13]) -> 133.3 | L13: of:=[.K13]/300 -> 0.444333333333333 | N13: 2 | O13: of:=[.N13]*5 -> 10 | P13: 1.91k | S13: X
A14: R7,R8 | B14: R_0805.fp | C14: 2.15k | D14: Vishay | E14: CRCW08052K15FKEA | F14: 71-CRCW08052K15FKEA | G14: 0.064 | H14: of:=[.O14]*[.G14] -> 0.64 | I14: 2141804 | J14: 13.33 | K14: of:=[.J14]*MAX([.M14];[.O14]) -> 133.3 | L14: of:=[.K14]/300 -> 0.444333333333333 | N14: 2 | O14: of:=[.N14]*5 -> 10 | P14: 2.43k | S14: X
A15: U1,U2 | B15: TO220AB.fp | D15: ON Semiconductor | E15: LM317TG | F15: 863-LM317TG | G15: 0.464 | H15: of:=[.O15]*[.G15] -> 4.64 | I15: 1652293 | J15: 186.66 | K15: of:=[.J15]*MAX([.M15];[.O15]) -> 1866.6 | L15: of:=[.K15]/300 -> 6.222 | N15: 2 | O15: of:=[.N15]*5 -> 10 | S15: X
A16: U3 | B16: TO220AB.fp | D16: ON Semiconductor | E16: LM337TG | F16: 863-LM337TG | G16: 0.648 | H16: of:=[.O16]*[.G16] -> 3.24 | I16: 1211104 | J16: 236.18 | K16: of:=[.J16]*MAX([.M16];[.O16]) -> 1180.9 | L16: of:=[.K16]/300 -> 3.93633333333333 | N16: 1 | O16: of:=[.N16]*5 -> 5 | S16: X
H18: of:=SUM([.H2:.H16]) -> 51.98 | K18: of:=SUM([.K2:.K16]) -> 21290.7