Sheet: Sheet1
A1: refdes | E1: footprint | F1: value | G1: manuf | H1: manuf-pn | I1: mouser-pn | J1: farnell-pn
A2: C1 | B2: of:=SEARCH("[0-9]";[.A2];1) -> 2 | C2: of:=MID([.A2];1;[.B2]-1) -> C | D2: of:=NUMBERVALUE(MID([.A2];[.B2];100)) -> 1 | E2: C_RADIAL_400.fp | F2: 100n | G2: Panasonic | H2: ECQ-E6104KF | I2: 667-ECQ-E6104KF
A3: C2 | B3: of:=SEARCH("[0-9]";[.A3];1) -> 2 | C3: of:=MID([.A3];1;[.B3]-1) -> C | D3: of:=NUMBERVALUE(MID([.A3];[.B3];100)) -> 2 | E3: CP_CAN_SNAP.fp | F3: 10000µ | G3: United Chemi-Con | H3: ESMH500VNN103MA35T | I3: 661-ESMH500VNN103MA3
A4: C2 | B4: of:=SEARCH("[0-9]";[.A4];1) -> 2 | C4: of:=MID([.A4];1;[.B4]-1) -> C | D4: of:=NUMBERVALUE(MID([.A4];[.B4];100)) -> 2 | E4: CP_CAN_SNAP.fp | F4: 1000µ | G4: United Chemi-Con | H4: ESMH251VNN102MA40T | I4: 661-ESMH251VNN102MA
A5: C2 | B5: of:=SEARCH("[0-9]";[.A5];1) -> 2 | C5: of:=MID([.A5];1;[.B5]-1) -> C | D5: of:=NUMBERVALUE(MID([.A5];[.B5];100)) -> 2 | E5: CP_CAN_SNAP.fp | F5: 4700µ | G5: United Chemi-Con | H5: ESMH101VNN472MR50T | I5: 661-ESMH101VNN472MR5
A6: C3 | B6: of:=SEARCH("[0-9]";[.A6];1) -> 2 | C6: of:=MID([.A6];1;[.B6]-1) -> C | D6: of:=NUMBERVALUE(MID([.A6];[.B6];100)) -> 3 | E6: CP_CAN_200.fp | F6: 470µ | G6: Nichicon | H6: UPW1H471MHD | I6: 647-UPW1H471MHD
A7: C3 | B7: of:=SEARCH("[0-9]";[.A7];1) -> 2 | C7: of:=MID([.A7];1;[.B7]-1) -> C | D7: of:=NUMBERVALUE(MID([.A7];[.B7];100)) -> 3 | E7: CP_CAN_300.fp | F7: 100µ | G7: Nichicon | H7: UPW2E101MHD | I7: 647-UPW2E101MHD
A8: C3 | B8: of:=SEARCH("[0-9]";[.A8];1) -> 2 | C8: of:=MID([.A8];1;[.B8]-1) -> C | D8: of:=NUMBERVALUE(MID([.A8];[.B8];100)) -> 3 | E8: CP_CAN_300.fp | F8: 220µ | G8: Nichicon | H8: UPW2A221MHD | I8: 647-UPW2A221MHD
A9: C4 | B9: of:=SEARCH("[0-9]";[.A9];1) -> 2 | C9: of:=MID([.A9];1;[.B9]-1) -> C | D9: of:=NUMBERVALUE(MID([.A9];[.B9];100)) -> 4 | E9: C_1812.fp | F9: 100n
A10: C4 | B10: of:=SEARCH("[0-9]";[.A10];1) -> 2 | C10: of:=MID([.A10];1;[.B10]-1) -> C | D10: of:=NUMBERVALUE(MID([.A10];[.B10];100)) -> 4 | E10: C_1812.fp | F10: DNP
A11: C5 | B11: of:=SEARCH("[0-9]";[.A11];1) -> 2 | C11: of:=MID([.A11];1;[.B11]-1) -> C | D11: of:=NUMBERVALUE(MID([.A11];[.B11];100)) -> 5 | E11: C_1812.fp | F11: 100n
A12: C5 | B12: of:=SEARCH("[0-9]";[.A12];1) -> 2 | C12: of:=MID([.A12];1;[.B12]-1) -> C | D12: of:=NUMBERVALUE(MID([.A12];[.B12];100)) -> 5 | E12: C_1812.fp | F12: DNP
A13: C6 | B13: of:=SEARCH("[0-9]";[.A13];1) -> 2 | C13: of:=MID([.A13];1;[.B13]-1) -> C | D13: of:=NUMBERVALUE(MID([.A13];[.B13];100)) -> 6 | E13: C_0805.fp | F13: 2200p
A14: C6 | B14: of:=SEARCH("[0-9]";[.A14];1) -> 2 | C14: of:=MID([.A14];1;[.B14]-1) -> C | D14: of:=NUMBERVALUE(MID([.A14];[.B14];100)) -> 6 | E14: C_0805.fp | F14: 22p
A15: C10 | B15: of:=SEARCH("[0-9]";[.A15];1) -> 2 | C15: of:=MID([.A15];1;[.B15]-1) -> C | D15: of:=NUMBERVALUE(MID([.A15];[.B15];100)) -> 10 | E15: C_1812.fp | F15: 1µ
A16: C10 | B16: of:=SEARCH("[0-9]";[.A16];1) -> 2 | C16: of:=MID([.A16];1;[.B16]-1) -> C | D16: of:=NUMBERVALUE(MID([.A16];[.B16];100)) -> 10 | E16: C_1812.fp | F16: 6.8µ
A17: C12 | B17: of:=SEARCH("[0-9]";[.A17];1) -> 2 | C17: of:=MID([.A17];1;[.B17]-1) -> C | D17: of:=NUMBERVALUE(MID([.A17];[.B17];100)) -> 12 | E17: C_0805.fp | F17: 120p
A18: C12 | B18: of:=SEARCH("[0-9]";[.A18];1) -> 2 | C18: of:=MID([.A18];1;[.B18]-1) -> C | D18: of:=NUMBERVALUE(MID([.A18];[.B18];100)) -> 12 | E18: C_0805.fp | F18: 180p
A19: C12 | B19: of:=SEARCH("[0-9]";[.A19];1) -> 2 | C19: of:=MID([.A19];1;[.B19]-1) -> C | D19: of:=NUMBERVALUE(MID([.A19];[.B19];100)) -> 12 | E19: C_0805.fp | F19: 220p
A20: C20 | B20: of:=SEARCH("[0-9]";[.A20];1) -> 2 | C20: of:=MID([.A20];1;[.B20]-1) -> C | D20: of:=NUMBERVALUE(MID([.A20];[.B20];100)) -> 20 | E20: C_0805.fp | F20: 18p
A21: C22 | B21: of:=SEARCH("[0-9]";[.A21];1) -> 2 | C21: of:=MID([.A21];1;[.B21]-1) -> C | D21: of:=NUMBERVALUE(MID([.A21];[.B21];100)) -> 22 | E21: C_0805.fp | F21: 100n
A22: C22 | B22: of:=SEARCH("[0-9]";[.A22];1) -> 2 | C22: of:=MID([.A22];1;[.B22]-1) -> C | D22: of:=NUMBERVALUE(MID([.A22];[.B22];100)) -> 22 | E22: C_0805.fp | F22: DNP
A23: C23 | B23: of:=SEARCH("[0-9]";[.A23];1) -> 2 | C23: of:=MID([.A23];1;[.B23]-1) -> C | D23: of:=NUMBERVALUE(MID([.A23];[.B23];100)) -> 23 | E23: C_0805.fp | F23: 100n
A24: C23 | B24: of:=SEARCH("[0-9]";[.A24];1) -> 2 | C24: of:=MID([.A24];1;[.B24]-1) -> C | D24: of:=NUMBERVALUE(MID([.A24];[.B24];100)) -> 23 | E24: C_0805.fp | F24: DNP
A25: C40 | B25: of:=SEARCH("[0-9]";[.A25];1) -> 2 | C25: of:=MID([.A25];1;[.B25]-1) -> C | D25: of:=NUMBERVALUE(MID([.A25];[.B25];100)) -> 40 | E25: C_0805.fp | F25: 100n
A26: C41 | B26: of:=SEARCH("[0-9]";[.A26];1) -> 2 | C26: of:=MID([.A26];1;[.B26]-1) -> C | D26: of:=NUMBERVALUE(MID([.A26];[.B26];100)) -> 41 | E26: C_0805.fp | F26: 100n
A27: C42 | B27: of:=SEARCH("[0-9]";[.A27];1) -> 2 | C27: of:=MID([.A27];1;[.B27]-1) -> C | D27: of:=NUMBERVALUE(MID([.A27];[.B27];100)) -> 42 | E27: C_0805.fp | F27: 100n
A28: C43 | B28: of:=SEARCH("[0-9]";[.A28];1) -> 2 | C28: of:=MID([.A28];1;[.B28]-1) -> C | D28: of:=NUMBERVALUE(MID([.A28];[.B28];100)) -> 43 | E28: C_0805.fp | F28: 100n
A29: C45 | B29: of:=SEARCH("[0-9]";[.A29];1) -> 2 | C29: of:=MID([.A29];1;[.B29]-1) -> C | D29: of:=NUMBERVALUE(MID([.A29];[.B29];100)) -> 45 | E29: C_0805.fp | F29: 100n
A30: C46 | B30: of:=SEARCH("[0-9]";[.A30];1) -> 2 | C30: of:=MID([.A30];1;[.B30]-1) -> C | D30: of:=NUMBERVALUE(MID([.A30];[.B30];100)) -> 46 | E30: C_0805.fp | F30: 100n
A31: CR2 | B31: of:=SEARCH("[0-9]";[.A31];1) -> 3 | C31: of:=MID([.A31];1;[.B31]-1) -> CR | D31: of:=NUMBERVALUE(MID([.A31];[.B31];100)) -> 2 | E31: D_GBU.fp | F31: KBPC606 | G31: Fairchild | H31: GBU8J | I31: 512-GBU8J
A32: CR3 | B32: of:=SEARCH("[0-9]";[.A32];1) -> 3 | C32: of:=MID([.A32];1;[.B32]-1) -> CR | D32: of:=NUMBERVALUE(MID([.A32];[.B32];100)) -> 3 | E32: D_SMC.fp | F32: MR854 | G32: Diodes Inc | H32: S5BC-13-F | I32: 621-S5BC-F
A33: CR4 | B33: of:=SEARCH("[0-9]";[.A33];1) -> 3 | C33: of:=MID([.A33];1;[.B33]-1) -> CR | D33: of:=NUMBERVALUE(MID([.A33];[.B33];100)) -> 4 | E33: SOT23_3.fp | F33: * | G33: Diodes Inc | H33: BAV99-13-F | I33: 621-BAV99-13-F
A34: CR5 | B34: of:=SEARCH("[0-9]";[.A34];1) -> 3 | C34: of:=MID([.A34];1;[.B34]-1) -> CR | D34: of:=NUMBERVALUE(MID([.A34];[.B34];100)) -> 5 | E34: SOT23_3.fp | F34: * | G34: Diodes Inc | H34: BAV99-13-F | I34: 621-BAV99-13-F
A35: CR6 | B35: of:=SEARCH("[0-9]";[.A35];1) -> 3 | C35: of:=MID([.A35];1;[.B35]-1) -> CR | D35: of:=NUMBERVALUE(MID([.A35];[.B35];100)) -> 6 | E35: D_SMA.fp | F35: *
A36: CR7 | B36: of:=SEARCH("[0-9]";[.A36];1) -> 3 | C36: of:=MID([.A36];1;[.B36]-1) -> CR | D36: of:=NUMBERVALUE(MID([.A36];[.B36];100)) -> 7 | E36: D_SMA.fp | F36: *
A37: CR8 | B37: of:=SEARCH("[0-9]";[.A37];1) -> 3 | C37: of:=MID([.A37];1;[.B37]-1) -> CR | D37: of:=NUMBERVALUE(MID([.A37];[.B37];100)) -> 8 | E37: SOT23_3.fp | F37: *
A38: CR10 | B38: of:=SEARCH("[0-9]";[.A38];1) -> 3 | C38: of:=MID([.A38];1;[.B38]-1) -> CR | D38: of:=NUMBERVALUE(MID([.A38];[.B38];100)) -> 10 | E38: SOT23_3.fp | F38: * | G38: Fairchild | H38: MMBD1501A | I38: 512-MMBD1501A
A39: CR11 | B39: of:=SEARCH("[0-9]";[.A39];1) -> 3 | C39: of:=MID([.A39];1;[.B39]-1) -> CR | D39: of:=NUMBERVALUE(MID([.A39];[.B39];100)) -> 11 | E39: SOT23_3.fp | F39: * | G39: Fairchild | H39: MMBD1501A | I39: 512-MMBD1501A
A40: J1 | B40: of:=SEARCH("[0-9]";[.A40];1) -> 2 | C40: of:=MID([.A40];1;[.B40]-1) -> J | D40: of:=NUMBERVALUE(MID([.A40];[.B40];100)) -> 1 | E40: TE_AMPMODU_MTE_4.fp | F40: +V_BIAS | G40: TE Connectivity | H40: 5-104450-3 | I40: 571-5-104450-3
A41: J2 | B41: of:=SEARCH("[0-9]";[.A41];1) -> 2 | C41: of:=MID([.A41];1;[.B41]-1) -> J | D41: of:=NUMBERVALUE(MID([.A41];[.B41];100)) -> 2 | E41: TE_MINI_UNIVERSAL_MATE_N_LOCK_3.fp | F41: +INPUT | G41: TE Connectivity | H41: 1-770170-1 | I41: 571-1-770170-1
A42: J3 | B42: of:=SEARCH("[0-9]";[.A42];1) -> 2 | C42: of:=MID([.A42];1;[.B42]-1) -> J | D42: of:=NUMBERVALUE(MID([.A42];[.B42];100)) -> 3 | E42: TE_AMPMODU_MTE_8.fp | F42: CC INDICATOR | G42: TE Connectivity | H42: 5-104450-7 | I42: 571-5-104450-7
A43: J4 | B43: of:=SEARCH("[0-9]";[.A43];1) -> 2 | C43: of:=MID([.A43];1;[.B43]-1) -> J | D43: of:=NUMBERVALUE(MID([.A43];[.B43];100)) -> 4 | E43: TE_MINI_UNIVERSAL_MATE_N_LOCK_3.fp | F43: +OUTPUT | G43: TE Connectivity | H43: 1-770170-1 | I43: 571-1-770170-1
A44: JP1 | B44: of:=SEARCH("[0-9]";[.A44];1) -> 3 | C44: of:=MID([.A44];1;[.B44]-1) -> JP | D44: of:=NUMBERVALUE(MID([.A44];[.B44];100)) -> 1 | E44: R_1206.fp | F44: 0
A45: JP1 | B45: of:=SEARCH("[0-9]";[.A45];1) -> 3 | C45: of:=MID([.A45];1;[.B45]-1) -> JP | D45: of:=NUMBERVALUE(MID([.A45];[.B45];100)) -> 1 | E45: R_1206.fp | F45: DNP
A46: JP2 | B46: of:=SEARCH("[0-9]";[.A46];1) -> 3 | C46: of:=MID([.A46];1;[.B46]-1) -> JP | D46: of:=NUMBERVALUE(MID([.A46];[.B46];100)) -> 2 | E46: R_1206.fp | F46: 0
A47: JP2 | B47: of:=SEARCH("[0-9]";[.A47];1) -> 3 | C47: of:=MID([.A47];1;[.B47]-1) -> JP | D47: of:=NUMBERVALUE(MID([.A47];[.B47];100)) -> 2 | E47: R_1206.fp | F47: DNP
A48: Q1 | B48: of:=SEARCH("[0-9]";[.A48];1) -> 2 | C48: of:=MID([.A48];1;[.B48]-1) -> Q | D48: of:=NUMBERVALUE(MID([.A48];[.B48];100)) -> 1 | E48: TO247.fp | F48: 2N6056 | G48: ST | H48: TIP35C | I48: 511-TIP35C
A49: Q1 | B49: of:=SEARCH("[0-9]";[.A49];1) -> 2 | C49: of:=MID([.A49];1;[.B49]-1) -> Q | D49: of:=NUMBERVALUE(MID([.A49];[.B49];100)) -> 1 | E49: TO247.fp | F49: IRF440 | G49: Vishay Siliconix | H49: IRFP440PBF | I49: 844-IRFP440PBF
A50: Q2 | B50: of:=SEARCH("[0-9]";[.A50];1) -> 2 | C50: of:=MID([.A50];1;[.B50]-1) -> Q | D50: of:=NUMBERVALUE(MID([.A50];[.B50];100)) -> 2 | E50: SOT23_3.fp | F50: 2N4036 | G50: Diodes Inc | H50: ZXTP25140BFHTA | I50: 621-ZXTP25140BFHTA
A51: Q3 | B51: of:=SEARCH("[0-9]";[.A51];1) -> 2 | C51: of:=MID([.A51];1;[.B51]-1) -> Q | D51: of:=NUMBERVALUE(MID([.A51];[.B51];100)) -> 3 | E51: TO247.fp | F51: 2N6056 | G51: ST | H51: TIP35C | I51: 511-TIP35C
A52: Q3 | B52: of:=SEARCH("[0-9]";[.A52];1) -> 2 | C52: of:=MID([.A52];1;[.B52]-1) -> Q | D52: of:=NUMBERVALUE(MID([.A52];[.B52];100)) -> 3 | E52: TO247.fp | F52: IRF440 | G52: Vishay Siliconix | H52: IRFP440PBF | I52: 844-IRFP440PBF
A53: Q4 | B53: of:=SEARCH("[0-9]";[.A53];1) -> 2 | C53: of:=MID([.A53];1;[.B53]-1) -> Q | D53: of:=NUMBERVALUE(MID([.A53];[.B53];100)) -> 4 | E53: SOT23_3.fp | F53: 2N2222 | G53: Diodes Inc | H53: MMBT2222A-7-F | I53: 621-MMBT2222A-F | J53: 1773626
A54: Q4 | B54: of:=SEARCH("[0-9]";[.A54];1) -> 2 | C54: of:=MID([.A54];1;[.B54]-1) -> Q | D54: of:=NUMBERVALUE(MID([.A54];[.B54];100)) -> 4 | E54: SOT23_3.fp | F54: 2N2222
A55: Q5 | B55: of:=SEARCH("[0-9]";[.A55];1) -> 2 | C55: of:=MID([.A55];1;[.B55]-1) -> Q | D55: of:=NUMBERVALUE(MID([.A55];[.B55];100)) -> 5 | E55: SOT23_3.fp | F55: 2N2222 | G55: Diodes Inc | H55: MMBT2222A-7-F | I55: 621-MMBT2222A-F | J55: 1773626
A56: Q5 | B56: of:=SEARCH("[0-9]";[.A56];1) -> 2 | C56: of:=MID([.A56];1;[.B56]-1) -> Q | D56: of:=NUMBERVALUE(MID([.A56];[.B56];100)) -> 5 | E56: SOT23_3.fp | F56: 2N2222
A57: R1 | B57: of:=SEARCH("[0-9]";[.A57];1) -> 2 | C57: of:=MID([.A57];1;[.B57]-1) -> R | D57: of:=NUMBERVALUE(MID([.A57];[.B57];100)) -> 1 | E57: TE_SM_3.fp | F57: 2k | G57: TE Connectivity | H57: SMF32K2JT | I57: 279-SMF32K2JT | J57: 1086413
A58: R1 | B58: of:=SEARCH("[0-9]";[.A58];1) -> 2 | C58: of:=MID([.A58];1;[.B58]-1) -> R | D58: of:=NUMBERVALUE(MID([.A58];[.B58];100)) -> 1 | E58: TE_SM_3.fp | F58: 45k | G58: TE Connectivity | H58: SMF347KJT | I58: 279-SMF347KJT | J58: 1086432
A59: R1 | B59: of:=SEARCH("[0-9]";[.A59];1) -> 2 | C59: of:=MID([.A59];1;[.B59]-1) -> R | D59: of:=NUMBERVALUE(MID([.A59];[.B59];100)) -> 1 | E59: TE_SM_3.fp | F59: 5k | G59: TE Connectivity | H59: SMF34K7JT | I59: 279-SMF34K7JT | J59: 1086417
A60: R2 | B60: of:=SEARCH("[0-9]";[.A60];1) -> 2 | C60: of:=MID([.A60];1;[.B60]-1) -> R | D60: of:=NUMBERVALUE(MID([.A60];[.B60];100)) -> 2 | E60: R_AXIAL_1200.fp | F60: 1.78 | G60: Vishay | H60: RW74U1R75FB12 | I60: 71-RW74U1R75F
A61: R2 | B61: of:=SEARCH("[0-9]";[.A61];1) -> 2 | C61: of:=MID([.A61];1;[.B61]-1) -> R | D61: of:=NUMBERVALUE(MID([.A61];[.B61];100)) -> 2 | E61: R_AXIAL_1200.fp | F61: 0.1 | G61: Vishay | H61: RS005R1000FE12 | I61: 71-RS005R1000FE12
A62: R2 | B62: of:=SEARCH("[0-9]";[.A62];1) -> 2 | C62: of:=MID([.A62];1;[.B62]-1) -> R | D62: of:=NUMBERVALUE(MID([.A62];[.B62];100)) -> 2 | E62: R_AXIAL_1200.fp | F62: 0.2 | G62: Vishay | H62: RS005R2000FE12 | I62: 71-RS005R2000FE12
A63: R3 | B63: of:=SEARCH("[0-9]";[.A63];1) -> 2 | C63: of:=MID([.A63];1;[.B63]-1) -> R | D63: of:=NUMBERVALUE(MID([.A63];[.B63];100)) -> 3 | E63: R_0805.fp | F63: 1.2k
A64: R4 | B64: of:=SEARCH("[0-9]";[.A64];1) -> 2 | C64: of:=MID([.A64];1;[.B64]-1) -> R | D64: of:=NUMBERVALUE(MID([.A64];[.B64];100)) -> 4 | E64: R_0805.fp | F64: 1k
A65: R5 | B65: of:=SEARCH("[0-9]";[.A65];1) -> 2 | C65: of:=MID([.A65];1;[.B65]-1) -> R | D65: of:=NUMBERVALUE(MID([.A65];[.B65];100)) -> 5 | E65: R_0805.fp | F65: 5k
A66: R6 | B66: of:=SEARCH("[0-9]";[.A66];1) -> 2 | C66: of:=MID([.A66];1;[.B66]-1) -> R | D66: of:=NUMBERVALUE(MID([.A66];[.B66];100)) -> 6 | E66: R_0805.fp | F66: 0
A67: R6 | B67: of:=SEARCH("[0-9]";[.A67];1) -> 2 | C67: of:=MID([.A67];1;[.B67]-1) -> R | D67: of:=NUMBERVALUE(MID([.A67];[.B67];100)) -> 6 | E67: R_0805.fp | F67: 1.5M
A68: R8 | B68: of:=SEARCH("[0-9]";[.A68];1) -> 2 | C68: of:=MID([.A68];1;[.B68]-1) -> R | D68: of:=NUMBERVALUE(MID([.A68];[.B68];100)) -> 8 | E68: R_0805.fp | F68: 1k
A69: R8 | B69: of:=SEARCH("[0-9]";[.A69];1) -> 2 | C69: of:=MID([.A69];1;[.B69]-1) -> R | D69: of:=NUMBERVALUE(MID([.A69];[.B69];100)) -> 8 | E69: R_0805.fp | F69: 5k
A70: R10 | B70: of:=SEARCH("[0-9]";[.A70];1) -> 2 | C70: of:=MID([.A70];1;[.B70]-1) -> R | D70: of:=NUMBERVALUE(MID([.A70];[.B70];100)) -> 10 | E70: R_1206.fp | F70: 21.5
A71: R10 | B71: of:=SEARCH("[0-9]";[.A71];1) -> 2 | C71: of:=MID([.A71];1;[.B71]-1) -> R | D71: of:=NUMBERVALUE(MID([.A71];[.B71];100)) -> 10 | E71: R_1206.fp | F71: 75
A72: R11 | B72: of:=SEARCH("[0-9]";[.A72];1) -> 2 | C72: of:=MID([.A72];1;[.B72]-1) -> R | D72: of:=NUMBERVALUE(MID([.A72];[.B72];100)) -> 11 | E72: R_0805.fp | F72: 10k
A73: R11 | B73: of:=SEARCH("[0-9]";[.A73];1) -> 2 | C73: of:=MID([.A73];1;[.B73]-1) -> R | D73: of:=NUMBERVALUE(MID([.A73];[.B73];100)) -> 11 | E73: R_0805.fp | F73: DNP
A74: R12 | B74: of:=SEARCH("[0-9]";[.A74];1) -> 2 | C74: of:=MID([.A74];1;[.B74]-1) -> R | D74: of:=NUMBERVALUE(MID([.A74];[.B74];100)) -> 12 | E74: R_0805.fp | F74: 0
A75: R12 | B75: of:=SEARCH("[0-9]";[.A75];1) -> 2 | C75: of:=MID([.A75];1;[.B75]-1) -> R | D75: of:=NUMBERVALUE(MID([.A75];[.B75];100)) -> 12 | E75: R_0805.fp | F75: 10k
A76: R13 | B76: of:=SEARCH("[0-9]";[.A76];1) -> 2 | C76: of:=MID([.A76];1;[.B76]-1) -> R | D76: of:=NUMBERVALUE(MID([.A76];[.B76];100)) -> 13 | E76: TE_SM_3.fp | F76: 1k | G76: TE Connectivity | H76: SMF31K0JT | I76: 279-SMF31K0JT | J76: 1086409
A77: R13 | B77: of:=SEARCH("[0-9]";[.A77];1) -> 2 | C77: of:=MID([.A77];1;[.B77]-1) -> R | D77: of:=NUMBERVALUE(MID([.A77];[.B77];100)) -> 13 | E77: TE_SM_3.fp | F77: 5k | G77: TE Connectivity | H77: SMF34K7JT | I77: 279-SMF34K7JT | J77: 1086417
A78: R14 | B78: of:=SEARCH("[0-9]";[.A78];1) -> 2 | C78: of:=MID([.A78];1;[.B78]-1) -> R | D78: of:=NUMBERVALUE(MID([.A78];[.B78];100)) -> 14 | E78: R_0805.fp | F78: 1k
A79: R15 | B79: of:=SEARCH("[0-9]";[.A79];1) -> 2 | C79: of:=MID([.A79];1;[.B79]-1) -> R | D79: of:=NUMBERVALUE(MID([.A79];[.B79];100)) -> 15 | E79: TE_SM_3.fp | F79: 14.3k | G79: TE Connectivity | H79: SMF315KJT | I79: 279-SMF315KJT | J79: 1086425
A80: R15 | B80: of:=SEARCH("[0-9]";[.A80];1) -> 2 | C80: of:=MID([.A80];1;[.B80]-1) -> R | D80: of:=NUMBERVALUE(MID([.A80];[.B80];100)) -> 15 | E80: TE_SM_3.fp | F80: 3.65k | G80: TE Connectivity | H80: SMF33K3JT | I80: 279-SMF33K3JT | J80: 1086415
A81: R15 | B81: of:=SEARCH("[0-9]";[.A81];1) -> 2 | C81: of:=MID([.A81];1;[.B81]-1) -> R | D81: of:=NUMBERVALUE(MID([.A81];[.B81];100)) -> 15 | E81: TE_SM_3.fp | F81: 6.19k | G81: TE Connectivity | H81: SMF36K8JT | I81: 279-SMF36K8JT
A82: R16 | B82: of:=SEARCH("[0-9]";[.A82];1) -> 2 | C82: of:=MID([.A82];1;[.B82]-1) -> R | D82: of:=NUMBERVALUE(MID([.A82];[.B82];100)) -> 16 | E82: R_0805.fp | F82: 10k
A83: R17 | B83: of:=SEARCH("[0-9]";[.A83];1) -> 2 | C83: of:=MID([.A83];1;[.B83]-1) -> R | D83: of:=NUMBERVALUE(MID([.A83];[.B83];100)) -> 17 | E83: R_1206.fp | F83: 900k
A84: R18 | B84: of:=SEARCH("[0-9]";[.A84];1) -> 2 | C84: of:=MID([.A84];1;[.B84]-1) -> R | D84: of:=NUMBERVALUE(MID([.A84];[.B84];100)) -> 18 | E84: R_1206.fp | F84: 100k
A85: R18 | B85: of:=SEARCH("[0-9]";[.A85];1) -> 2 | C85: of:=MID([.A85];1;[.B85]-1) -> R | D85: of:=NUMBERVALUE(MID([.A85];[.B85];100)) -> 18 | E85: R_1206.fp | F85: 9.09k
A86: R19 | B86: of:=SEARCH("[0-9]";[.A86];1) -> 2 | C86: of:=MID([.A86];1;[.B86]-1) -> R | D86: of:=NUMBERVALUE(MID([.A86];[.B86];100)) -> 19 | E86: TE_AMPMODU_MTE_3.fp | F86: 10k | G86: TE Connectivity | H86: 5-104450-2 | I86: 571-5-104450-2
A87: R20 | B87: of:=SEARCH("[0-9]";[.A87];1) -> 2 | C87: of:=MID([.A87];1;[.B87]-1) -> R | D87: of:=NUMBERVALUE(MID([.A87];[.B87];100)) -> 20 | E87: TRIMMER_TOP_S.fp | F87: 50k | G87: Bourns | H87: 3296Y-1-503LF | I87: 652-3296Y-1-503LF
A88: R22 | B88: of:=SEARCH("[0-9]";[.A88];1) -> 2 | C88: of:=MID([.A88];1;[.B88]-1) -> R | D88: of:=NUMBERVALUE(MID([.A88];[.B88];100)) -> 22 | E88: R_0805.fp | F88: 2.5k
A89: R22 | B89: of:=SEARCH("[0-9]";[.A89];1) -> 2 | C89: of:=MID([.A89];1;[.B89]-1) -> R | D89: of:=NUMBERVALUE(MID([.A89];[.B89];100)) -> 22 | E89: R_0805.fp | F89: 7.5k
A90: R23 | B90: of:=SEARCH("[0-9]";[.A90];1) -> 2 | C90: of:=MID([.A90];1;[.B90]-1) -> R | D90: of:=NUMBERVALUE(MID([.A90];[.B90];100)) -> 23 | E90: R_0805.fp | F90: 2.5k
A91: R23 | B91: of:=SEARCH("[0-9]";[.A91];1) -> 2 | C91: of:=MID([.A91];1;[.B91]-1) -> R | D91: of:=NUMBERVALUE(MID([.A91];[.B91];100)) -> 23 | E91: R_0805.fp | F91: 7.5k
A92: R24 | B92: of:=SEARCH("[0-9]";[.A92];1) -> 2 | C92: of:=MID([.A92];1;[.B92]-1) -> R | D92: of:=NUMBERVALUE(MID([.A92];[.B92];100)) -> 24 | E92: R_0805.fp | F92: 50k
A93: R25 | B93: of:=SEARCH("[0-9]";[.A93];1) -> 2 | C93: of:=MID([.A93];1;[.B93]-1) -> R | D93: of:=NUMBERVALUE(MID([.A93];[.B93];100)) -> 25 | E93: R_0805.fp | F93: 1k
A94: R26 | B94: of:=SEARCH("[0-9]";[.A94];1) -> 2 | C94: of:=MID([.A94];1;[.B94]-1) -> R | D94: of:=NUMBERVALUE(MID([.A94];[.B94];100)) -> 26 | E94: R_0805.fp | F94: 10k
A95: R27 | B95: of:=SEARCH("[0-9]";[.A95];1) -> 2 | C95: of:=MID([.A95];1;[.B95]-1) -> R | D95: of:=NUMBERVALUE(MID([.A95];[.B95];100)) -> 27 | E95: R_1206.fp | F95: 0
A96: R27 | B96: of:=SEARCH("[0-9]";[.A96];1) -> 2 | C96: of:=MID([.A96];1;[.B96]-1) -> R | D96: of:=NUMBERVALUE(MID([.A96];[.B96];100)) -> 27 | E96: R_1206.fp | F96: 1
A97: R27 | B97: of:=SEARCH("[0-9]";[.A97];1) -> 2 | C97: of:=MID([.A97];1;[.B97]-1) -> R | D97: of:=NUMBERVALUE(MID([.A97];[.B97];100)) -> 27 | E97: R_1206.fp | F97: 6.8
A98: R28 | B98: of:=SEARCH("[0-9]";[.A98];1) -> 2 | C98: of:=MID([.A98];1;[.B98]-1) -> R | D98: of:=NUMBERVALUE(MID([.A98];[.B98];100)) -> 28 | E98: R_0805.fp | F98: 6.19k
A99: R28 | B99: of:=SEARCH("[0-9]";[.A99];1) -> 2 | C99: of:=MID([.A99];1;[.B99]-1) -> R | D99: of:=NUMBERVALUE(MID([.A99];[.B99];100)) -> 28 | E99: R_0805.fp | F99: 6.81k
A100: R29 | B100: of:=SEARCH("[0-9]";[.A100];1) -> 2 | C100: of:=MID([.A100];1;[.B100]-1) -> R | D100: of:=NUMBERVALUE(MID([.A100];[.B100];100)) -> 29 | E100: R_1206.fp | F100: 1k
A101: R30 | B101: of:=SEARCH("[0-9]";[.A101];1) -> 2 | C101: of:=MID([.A101];1;[.B101]-1) -> R | D101: of:=NUMBERVALUE(MID([.A101];[.B101];100)) -> 30 | E101: R_1206.fp | F101: 1k
A102: R31 | B102: of:=SEARCH("[0-9]";[.A102];1) -> 2 | C102: of:=MID([.A102];1;[.B102]-1) -> R | D102: of:=NUMBERVALUE(MID([.A102];[.B102];100)) -> 31 | E102: TRIMMER_TOP_S.fp | F102: 10k | G102: Bourns | H102: 3296Y-1-103LF | I102: 652-3296Y-1-103LF
A103: R32 | B103: of:=SEARCH("[0-9]";[.A103];1) -> 2 | C103: of:=MID([.A103];1;[.B103]-1) -> R | D103: of:=NUMBERVALUE(MID([.A103];[.B103];100)) -> 32 | E103: TRIMMER_TOP_S.fp | F103: 10k | G103: Bourns | H103: 3296Y-1-103LF | I103: 652-3296Y-1-103LF
A104: R33 | B104: of:=SEARCH("[0-9]";[.A104];1) -> 2 | C104: of:=MID([.A104];1;[.B104]-1) -> R | D104: of:=NUMBERVALUE(MID([.A104];[.B104];100)) -> 33 | E104: R_0805.fp | F104: 3.4k
A105: R33 | B105: of:=SEARCH("[0-9]";[.A105];1) -> 2 | C105: of:=MID([.A105];1;[.B105]-1) -> R | D105: of:=NUMBERVALUE(MID([.A105];[.B105];100)) -> 33 | E105: R_0805.fp | F105: 5.23k
A106: R33 | B106: of:=SEARCH("[0-9]";[.A106];1) -> 2 | C106: of:=MID([.A106];1;[.B106]-1) -> R | D106: of:=NUMBERVALUE(MID([.A106];[.B106];100)) -> 33 | E106: R_0805.fp | F106: 7.15k
A107: R34 | B107: of:=SEARCH("[0-9]";[.A107];1) -> 2 | C107: of:=MID([.A107];1;[.B107]-1) -> R | D107: of:=NUMBERVALUE(MID([.A107];[.B107];100)) -> 34 | E107: R_1206.fp | F107: 500k
A108: R34 | B108: of:=SEARCH("[0-9]";[.A108];1) -> 2 | C108: of:=MID([.A108];1;[.B108]-1) -> R | D108: of:=NUMBERVALUE(MID([.A108];[.B108];100)) -> 34 | E108: R_1206.fp | F108: 681k
A109: R34 | B109: of:=SEARCH("[0-9]";[.A109];1) -> 2 | C109: of:=MID([.A109];1;[.B109]-1) -> R | D109: of:=NUMBERVALUE(MID([.A109];[.B109];100)) -> 34 | E109: R_1206.fp | F109: DNP
A110: R35 | B110: of:=SEARCH("[0-9]";[.A110];1) -> 2 | C110: of:=MID([.A110];1;[.B110]-1) -> R | D110: of:=NUMBERVALUE(MID([.A110];[.B110];100)) -> 35 | E110: R_AXIAL_1200.fp | F110: 0.6 | G110: Vishay | H110: RW74UR604FB12 | I110: 71-RW74UR604F
A111: R35 | B111: of:=SEARCH("[0-9]";[.A111];1) -> 2 | C111: of:=MID([.A111];1;[.B111]-1) -> R | D111: of:=NUMBERVALUE(MID([.A111];[.B111];100)) -> 35 | E111: R_AXIAL_1200.fp | F111: 10 | G111: Vishay | H111: RS02B10R00FE70 | I111: 71-RS02B10R00FE70
A112: R35 | B112: of:=SEARCH("[0-9]";[.A112];1) -> 2 | C112: of:=MID([.A112];1;[.B112]-1) -> R | D112: of:=NUMBERVALUE(MID([.A112];[.B112];100)) -> 35 | E112: R_AXIAL_1200.fp | F112: 1.2 | G112: Vishay | H112: CW0051R200JE73 | I112: 71-CW0051R200JE73
A113: R36 | B113: of:=SEARCH("[0-9]";[.A113];1) -> 2 | C113: of:=MID([.A113];1;[.B113]-1) -> R | D113: of:=NUMBERVALUE(MID([.A113];[.B113];100)) -> 36 | E113: R_AXIAL_1200.fp | F113: 0.6 | G113: Vishay | H113: RW74UR604FB12 | I113: 71-RW74UR604F
A114: R36 | B114: of:=SEARCH("[0-9]";[.A114];1) -> 2 | C114: of:=MID([.A114];1;[.B114]-1) -> R | D114: of:=NUMBERVALUE(MID([.A114];[.B114];100)) -> 36 | E114: R_AXIAL_1200.fp | F114: 10 | G114: Vishay | H114: RS02B10R00FE70 | I114: 71-RS02B10R00FE70
A115: R36 | B115: of:=SEARCH("[0-9]";[.A115];1) -> 2 | C115: of:=MID([.A115];1;[.B115]-1) -> R | D115: of:=NUMBERVALUE(MID([.A115];[.B115];100)) -> 36 | E115: R_AXIAL_1200.fp | F115: 1.2 | G115: Vishay | H115: CW0051R200JE73 | I115: 71-CW0051R200JE73
A116: R37 | B116: of:=SEARCH("[0-9]";[.A116];1) -> 2 | C116: of:=MID([.A116];1;[.B116]-1) -> R | D116: of:=NUMBERVALUE(MID([.A116];[.B116];100)) -> 37 | E116: TE_AMPMODU_MTE_3.fp | F116: 100k | G116: TE Connectivity | H116: 5-104450-2 | I116: 571-5-104450-2
A117: R37 | B117: of:=SEARCH("[0-9]";[.A117];1) -> 2 | C117: of:=MID([.A117];1;[.B117]-1) -> R | D117: of:=NUMBERVALUE(MID([.A117];[.B117];100)) -> 37 | E117: TE_AMPMODU_MTE_3.fp | F117: 50k | G117: TE Connectivity | H117: 5-104450-2 | I117: 571-5-104450-2
A118: R38 | B118: of:=SEARCH("[0-9]";[.A118];1) -> 2 | C118: of:=MID([.A118];1;[.B118]-1) -> R | D118: of:=NUMBERVALUE(MID([.A118];[.B118];100)) -> 38 | E118: R_0805.fp | F118: 0
A119: R38 | B119: of:=SEARCH("[0-9]";[.A119];1) -> 2 | C119: of:=MID([.A119];1;[.B119]-1) -> R | D119: of:=NUMBERVALUE(MID([.A119];[.B119];100)) -> 38 | E119: R_0805.fp | F119: 75
A120: R39 | B120: of:=SEARCH("[0-9]";[.A120];1) -> 2 | C120: of:=MID([.A120];1;[.B120]-1) -> R | D120: of:=NUMBERVALUE(MID([.A120];[.B120];100)) -> 39 | E120: R_0805.fp | F120: 0
A121: R39 | B121: of:=SEARCH("[0-9]";[.A121];1) -> 2 | C121: of:=MID([.A121];1;[.B121]-1) -> R | D121: of:=NUMBERVALUE(MID([.A121];[.B121];100)) -> 39 | E121: R_0805.fp | F121: 75
A122: R40 | B122: of:=SEARCH("[0-9]";[.A122];1) -> 2 | C122: of:=MID([.A122];1;[.B122]-1) -> R | D122: of:=NUMBERVALUE(MID([.A122];[.B122];100)) -> 40 | E122: R_0805.fp | F122: 267k
A123: R41 | B123: of:=SEARCH("[0-9]";[.A123];1) -> 2 | C123: of:=MID([.A123];1;[.B123]-1) -> R | D123: of:=NUMBERVALUE(MID([.A123];[.B123];100)) -> 41 | E123: R_0805.fp | F123: 4.64k
A124: R43 | B124: of:=SEARCH("[0-9]";[.A124];1) -> 2 | C124: of:=MID([.A124];1;[.B124]-1) -> R | D124: of:=NUMBERVALUE(MID([.A124];[.B124];100)) -> 43 | E124: R_0805.fp | F124: 100k
A125: R43 | B125: of:=SEARCH("[0-9]";[.A125];1) -> 2 | C125: of:=MID([.A125];1;[.B125]-1) -> R | D125: of:=NUMBERVALUE(MID([.A125];[.B125];100)) -> 43 | E125: R_0805.fp | F125: DNP
A126: R44 | B126: of:=SEARCH("[0-9]";[.A126];1) -> 2 | C126: of:=MID([.A126];1;[.B126]-1) -> R | D126: of:=NUMBERVALUE(MID([.A126];[.B126];100)) -> 44 | E126: R_0805.fp | F126: 0
A127: R44 | B127: of:=SEARCH("[0-9]";[.A127];1) -> 2 | C127: of:=MID([.A127];1;[.B127]-1) -> R | D127: of:=NUMBERVALUE(MID([.A127];[.B127];100)) -> 44 | E127: R_0805.fp | F127: 31.6k
A128: R45 | B128: of:=SEARCH("[0-9]";[.A128];1) -> 2 | C128: of:=MID([.A128];1;[.B128]-1) -> R | D128: of:=NUMBERVALUE(MID([.A128];[.B128];100)) -> 45 | E128: R_0805.fp | F128: 0
A129: R45 | B129: of:=SEARCH("[0-9]";[.A129];1) -> 2 | C129: of:=MID([.A129];1;[.B129]-1) -> R | D129: of:=NUMBERVALUE(MID([.A129];[.B129];100)) -> 45 | E129: R_0805.fp | F129: 31.6k
A130: R46 | B130: of:=SEARCH("[0-9]";[.A130];1) -> 2 | C130: of:=MID([.A130];1;[.B130]-1) -> R | D130: of:=NUMBERVALUE(MID([.A130];[.B130];100)) -> 46 | E130: TE_SM_3.fp | F130: 1k | G130: TE Connectivity | H130: SMF31K0JT | I130: 279-SMF31K0JT | J130: 1086409
A131: R46 | B131: of:=SEARCH("[0-9]";[.A131];1) -> 2 | C131: of:=MID([.A131];1;[.B131]-1) -> R | D131: of:=NUMBERVALUE(MID([.A131];[.B131];100)) -> 46 | E131: TE_SM_3.fp | F131: 390 | G131: TE Connectivity | H131: SMF3390RJT | I131: 279-SMF3390RJT | J131: 1086403
A132: R46 | B132: of:=SEARCH("[0-9]";[.A132];1) -> 2 | C132: of:=MID([.A132];1;[.B132]-1) -> R | D132: of:=NUMBERVALUE(MID([.A132];[.B132];100)) -> 46 | E132: TE_SM_3.fp | F132: DNP
A133: S2 | B133: of:=SEARCH("[0-9]";[.A133];1) -> 2 | C133: of:=MID([.A133];1;[.B133]-1) -> S | D133: of:=NUMBERVALUE(MID([.A133];[.B133];100)) -> 2 | E133: TE_AMPMODU_MTE_3.fp | G133: TE Connectivity | H133: 5-104450-2 | I133: 571-5-104450-2
A134: TP2 | B134: of:=SEARCH("[0-9]";[.A134];1) -> 3 | C134: of:=MID([.A134];1;[.B134]-1) -> TP | D134: of:=NUMBERVALUE(MID([.A134];[.B134];100)) -> 2 | E134: TEST_PIN_2.fp
A135: TP3 | B135: of:=SEARCH("[0-9]";[.A135];1) -> 3 | C135: of:=MID([.A135];1;[.B135]-1) -> TP | D135: of:=NUMBERVALUE(MID([.A135];[.B135];100)) -> 3 | E135: TEST_PIN_2.fp
A136: TP4 | B136: of:=SEARCH("[0-9]";[.A136];1) -> 3 | C136: of:=MID([.A136];1;[.B136]-1) -> TP | D136: of:=NUMBERVALUE(MID([.A136];[.B136];100)) -> 4 | E136: TEST_PIN_2.fp
A137: TP5 | B137: of:=SEARCH("[0-9]";[.A137];1) -> 3 | C137: of:=MID([.A137];1;[.B137]-1) -> TP | D137: of:=NUMBERVALUE(MID([.A137];[.B137];100)) -> 5 | E137: TEST_PIN_2.fp
A138: TP6 | B138: of:=SEARCH("[0-9]";[.A138];1) -> 3 | C138: of:=MID([.A138];1;[.B138]-1) -> TP | D138: of:=NUMBERVALUE(MID([.A138];[.B138];100)) -> 6 | E138: TEST_PIN_2.fp
A139: TP7 | B139: of:=SEARCH("[0-9]";[.A139];1) -> 3 | C139: of:=MID([.A139];1;[.B139]-1) -> TP | D139: of:=NUMBERVALUE(MID([.A139];[.B139];100)) -> 7 | E139: TEST_PIN_2.fp
A140: U1 | B140: of:=SEARCH("[0-9]";[.A140];1) -> 2 | C140: of:=MID([.A140];1;[.B140]-1) -> U | D140: of:=NUMBERVALUE(MID([.A140];[.B140];100)) -> 1 | E140: SOIC_8.fp | F140: LF411CN | G140: Texas Instruments | H140: LF411CD | I140: 595-LF411CD
A141: U3 | B141: of:=SEARCH("[0-9]";[.A141];1) -> 2 | C141: of:=MID([.A141];1;[.B141]-1) -> U | D141: of:=NUMBERVALUE(MID([.A141];[.B141];100)) -> 3 | E141: SOIC_8.fp | F141: LM336BZ-5.0 | G141: Texas Instruments | H141: LM336BMX-5.0/NOPB | I141: 926-LM336BMX50/NOPB
A142: U4 | B142: of:=SEARCH("[0-9]";[.A142];1) -> 2 | C142: of:=MID([.A142];1;[.B142]-1) -> U | D142: of:=NUMBERVALUE(MID([.A142];[.B142];100)) -> 4 | E142: SOIC_14.fp | F142: LF442CN | G142: Texas Instruments | H142: LF444CM/NOPB | I142: 926-LF444CM/NOPB
A143: U5 | B143: of:=SEARCH("[0-9]";[.A143];1) -> 2 | C143: of:=MID([.A143];1;[.B143]-1) -> U | D143: of:=NUMBERVALUE(MID([.A143];[.B143];100)) -> 5 | E143: SOIC_8.fp | F143: LM393CN | G143: Texas Instruments | H143: LM393AD | I143: 595-LM393AD

Sheet: Pivot Table_Sheet1_1
A1: Filter
A3: footprint | B3: value | C3: manuf-pn
A4: C_0805.fp | B4: 100n | C4: (empty) | D4: 8
B5: 120p | C5: (empty) | D5: 1
B6: 180p | C6: (empty) | D6: 1
B7: 18p | C7: (empty) | D7: 1
B8: 2200p | C8: (empty) | D8: 1
B9: 220p | C9: (empty) | D9: 1
B10: 22p | C10: (empty) | D10: 1
B11: DNP | C11: (empty) | D11: 2
A12: C_1812.fp | B12: 100n | C12: (empty) | D12: 2
B13: 1µ | C13: (empty) | D13: 1
B14: 6.8µ | C14: (empty) | D14: 1
B15: DNP | C15: (empty) | D15: 2
A16: C_RADIAL_400.fp | B16: 100n | C16: ECQ-E6104KF | D16: 1
A17: CP_CAN_200.fp | B17: 470µ | C17: UPW1H471MHD | D17: 1
A18: CP_CAN_300.fp | B18: 100µ | C18: UPW2E101MHD | D18: 1
B19: 220µ | C19: UPW2A221MHD | D19: 1
A20: CP_CAN_SNAP.fp | B20: 10000µ | C20: ESMH500VNN103MA35T | D20: 1
B21: 1000µ | C21: ESMH251VNN102MA40T | D21: 1
B22: 4700µ | C22: ESMH101VNN472MR50T | D22: 1
A23: D_GBU.fp | B23: KBPC606 | C23: GBU8J | D23: 1
A24: D_SMA.fp | B24: * | C24: (empty) | D24: 2
A25: D_SMC.fp | B25: MR854 | C25: S5BC-13-F | D25: 1
A26: R_0805.fp | B26: 0 | C26: (empty) | D26: 6
B27: 75 | C27: (empty) | D27: 2
B28: 1.2k | C28: (empty) | D28: 1
B29: 1.5M | C29: (empty) | D29: 1
B30: 100k | C30: (empty) | D30: 1
B31: 10k | C31: (empty) | D31: 4
B32: 1k | C32: (empty) | D32: 4
B33: 2.5k | C33: (empty) | D33: 2
B34: 267k | C34: (empty) | D34: 1
B35: 3.4k | C35: (empty) | D35: 1
B36: 31.6k | C36: (empty) | D36: 2
B37: 4.64k | C37: (empty) | D37: 1
B38: 5.23k | C38: (empty) | D38: 1
B39: 50k | C39: (empty) | D39: 1
B40: 5k | C40: (empty) | D40: 2
B41: 6.19k | C41: (empty) | D41: 1
B42: 6.81k | C42: (empty) | D42: 1
B43: 7.15k | C43: (empty) | D43: 1
B44: 7.5k | C44: (empty) | D44: 2
B45: DNP | C45: (empty) | D45: 2
A46: R_1206.fp | B46: 0 | C46: (empty) | D46: 3
B47: 1 | C47: (empty) | D47: 1
B48: 6.8 | C48: (empty) | D48: 1
B49: 21.5 | C49: (empty) | D49: 1
B50: 75 | C50: (empty) | D50: 1
B51: 100k | C51: (empty) | D51: 1
B52: 1k | C52: (empty) | D52: 2
B53: 500k | C53: (empty) | D53: 1
B54: 681k | C54: (empty) | D54: 1
B55: 9.09k | C55: (empty) | D55: 1
B56: 900k | C56: (empty) | D56: 1
B57: DNP | C57: (empty) | D57: 3
A58: R_AXIAL_1200.fp | B58: 0.1 | C58: RS005R1000FE12 | D58: 1
B59: 0.2 | C59: RS005R2000FE12 | D59: 1
B60: 0.6 | C60: RW74UR604FB12 | D60: 2
B61: 1.2 | C61: CW0051R200JE73 | D61: 2
B62: 1.78 | C62: RW74U1R75FB12 | D62: 1
B63: 10 | C63: RS02B10R00FE70 | D63: 2
A64: SOIC_14.fp | B64: LF442CN | C64: LF444CM/NOPB | D64: 1
A65: SOIC_8.fp | B65: LF411CN | C65: LF411CD | D65: 1
B66: LM336BZ-5.0 | C66: LM336BMX-5.0/NOPB | D66: 1
B67: LM393CN | C67: LM393AD | D67: 1
A68: SOT23_3.fp | B68: * | C68: BAV99-13-F | D68: 2
C69: MMBD1501A | D69: 2
C70: (empty) | D70: 1
B71: 2N2222 | C71: MMBT2222A-7-F | D71: 2
C72: (empty) | D72: 2
B73: 2N4036 | C73: ZXTP25140BFHTA | D73: 1
A74: TE_AMPMODU_MTE_3.fp | B74: 100k | C74: 5-104450-2 | D74: 1
B75: 10k | C75: 5-104450-2 | D75: 1
B76: 50k | C76: 5-104450-2 | D76: 1
B77: (empty) | C77: 5-104450-2 | D77: 1
A78: TE_AMPMODU_MTE_4.fp | B78: +V_BIAS | C78: 5-104450-3 | D78: 1
A79: TE_AMPMODU_MTE_8.fp | B79: CC INDICATOR | C79: 5-104450-7 | D79: 1
A80: TE_MINI_UNIVERSAL_MATE_N_LOCK_3.fp | B80: +INPUT | C80: 1-770170-1 | D80: 1
B81: +OUTPUT | C81: 1-770170-1 | D81: 1
A82: TE_SM_3.fp | B82: 390 | C82: SMF3390RJT | D82: 1
B83: 14.3k | C83: SMF315KJT | D83: 1
B84: 1k | C84: SMF31K0JT | D84: 2
B85: 2k | C85: SMF32K2JT | D85: 1
B86: 3.65k | C86: SMF33K3JT | D86: 1
B87: 45k | C87: SMF347KJT | D87: 1
B88: 5k | C88: SMF34K7JT | D88: 2
B89: 6.19k | C89: SMF36K8JT | D89: 1
B90: DNP | C90: (empty) | D90: 1
A91: TEST_PIN_2.fp | B91: (empty) | C91: (empty) | D91: 6
A92: TO247.fp | B92: 2N6056 | C92: TIP35C | D92: 2
B93: IRF440 | C93: IRFP440PBF | D93: 2
A94: TRIMMER_TOP_S.fp | B94: 10k | C94: 3296Y-1-103LF | D94: 2
B95: 50k | C95: 3296Y-1-503LF | D95: 1
A96: Total Result | D96: 142